{"environment":{"buildPath":"/work","concurrency":4,"locale":"C.UTF-8","pythonHashSeed":"0","timezone":"UTC","umask":"022"},"lockType":"toolchain","platform":"linux-amd64","schemaVersion":1,"sourceDateEpoch":1788002152,"tools":[{"consumers":["build","package","runtime"],"id":"node","kind":"binary","license":"MIT","materialization":{"destination":"usr/local","root":"toolchain","stripComponents":1,"type":"tar-xz"},"mediaType":"application/x-xz","name":"Node.js","platform":"linux-amd64","sha256":"df770b2a6f130ed8627c9782c988fda9669fa23898329a61a871e32f965e007d","size":26169540,"sourceUrl":"https://raw.githubusercontent.com/sunwayking/JetOnlyOffice-license-evidence/v9.4.0-evidence.31/node/node-v20.20.2-linux-x64.tar.xz","version":"20.20.2"},{"consumers":["build"],"id":"npm-cache","kind":"npm","license":"(AFL-2.1 OR BSD-3-Clause) AND (BSD-3-Clause OR GPL-2.0) AND (MIT OR Apache-2.0) AND (MIT OR CC0-1.0) AND (WTFPL OR MIT) AND 0BSD AND AGPL-3.0 AND Apache-2.0 AND BSD-2-Clause AND BSD-3-Clause AND BlueOak-1.0.0 AND CC-BY-3.0 AND CC-BY-4.0 AND CC0-1.0 AND ISC AND MIT AND MIT-0 AND MPL-2.0 AND Unlicense","materialization":{"destination":"npm","root":"offline-cache","stripComponents":0,"type":"tar"},"mediaType":"application/x-tar","name":"npm offline cache","platform":"linux-amd64","sha256":"4975be16bfebd658a7380995d44a165d6885b5748689d822f1f8afd182f46a51","size":81438720,"sourceUrl":"https://raw.githubusercontent.com/sunwayking/JetOnlyOffice-license-evidence/v9.4.0-evidence.29/npm/npm-offline-cache.tar","version":"20260829"},{"consumers":["build"],"id":"pkg-fetch","kind":"pkg","license":"MIT","materialization":{"destination":"pkg","root":"offline-cache","stripComponents":0,"type":"tar"},"mediaType":"application/x-tar","name":"pkg-fetch base cache","platform":"linux-amd64","sha256":"2b644ece82b6b2bcd3b79dd79fb1549ef8508e8ebe8684e12cf76ff011dc9ebe","size":54814720,"sourceUrl":"https://raw.githubusercontent.com/sunwayking/JetOnlyOffice-license-evidence/v9.4.0-evidence.30/pkg/pkg-fetch-cache.tar","version":"v3.5"},{"consumers":["build"],"id":"pkg-toolchain","kind":"pkg","license":"MIT AND ISC AND Apache-2.0 AND BlueOak-1.0.0 AND BSD-3-Clause AND (MIT OR WTFPL) AND (BSD-2-Clause OR MIT OR Apache-2.0) AND BSD-2-Clause","materialization":{"destination":"usr/local","root":"toolchain","stripComponents":0,"type":"tar"},"mediaType":"application/x-tar","name":"@yao-pkg/pkg","platform":"linux-amd64","sha256":"5f9197c119dd410b9ceedc0789e93bd5f25cbe3959589f59cca2b4e1d3116dd3","size":21043200,"sourceUrl":"https://raw.githubusercontent.com/sunwayking/JetOnlyOffice-license-evidence/v9.4.0-evidence.30/pkg/pkg-toolchain.tar","version":"6.11.0"},{"consumers":["build"],"id":"python3","kind":"python","license":"PSF-2.0 AND MIT AND Apache-2.0 AND MPL-2.0 AND LGPL-2.1-only AND BSD-3-Clause AND BSD-2-Clause AND ISC AND (BSD-2-Clause OR Apache-2.0) AND OpenSSL AND Zlib AND bzip2-1.0.6","materialization":{"destination":"sources/build_tools/tools/linux","root":"sources","stripComponents":0,"type":"tar-gzip"},"mediaType":"application/gzip","name":"python3","platform":"linux-amd64","sha256":"c251fd88959ad83a64711d37d7897d0bf7a3ed272f23b6ef6216e0eed0bf9360","size":27370464,"sourceUrl":"https://raw.githubusercontent.com/sunwayking/JetOnlyOffice-license-evidence/v9.4.0-evidence.28/python/python3.tar.gz","version":"3.10.8"},{"consumers":["build"],"id":"qt","kind":"qt","license":"GPL-3.0-only AND MIT AND BSD-3-Clause AND BSD-2-Clause AND Zlib AND Libpng AND libpng-2.0 AND IJG AND libtiff AND CC0-1.0","materialization":{"destination":"sources/build_tools/tools/linux/qt_build/Qt-5.9.9","root":"sources","stripComponents":0,"type":"tar-xz"},"mediaType":"application/x-xz","name":"Qt","platform":"linux-amd64","sha256":"ae28c14084154f9075dab3b9f17a5b3415a0be036f5a8abff27cada3dcc234b4","size":33281840,"sourceUrl":"https://raw.githubusercontent.com/sunwayking/JetOnlyOffice-license-evidence/v9.4.0-evidence.28/qt/qt_binary_5.9.9_gcc_64.tar.xz","version":"5.9.9"},{"consumers":["build"],"id":"xz","kind":"apt","license":"GPL-2.0-or-later AND LGPL-2.1-or-later AND CC0-1.0","materialization":{"destination":"usr","root":"toolchain","type":"deb"},"mediaType":"application/vnd.debian.binary-package","name":"xz-utils","platform":"linux-amd64","sha256":"778edae086bc8f34d80f36f301bc8fb3eff2d906c146dfb533ea6840b6d64e00","size":267424,"sourceUrl":"https://archive.ubuntu.com/ubuntu/pool/main/x/xz-utils/xz-utils_5.6.1+really5.4.5-1ubuntu0.3_amd64.deb","version":"5.6.1+really5.4.5-1ubuntu0.3"},{"consumers":["build"],"id":"xz-lzma5","kind":"apt","license":"CC0-1.0","materialization":{"destination":"usr","root":"toolchain","type":"deb"},"mediaType":"application/vnd.debian.binary-package","name":"liblzma5","platform":"linux-amd64","sha256":"d2eabd41ca77d2c2dd9d5d4ef478cccb64ffde6279c47cf4699a857d46785a52","size":127352,"sourceUrl":"https://archive.ubuntu.com/ubuntu/pool/main/x/xz-utils/liblzma5_5.6.1+really5.4.5-1ubuntu0.3_amd64.deb","version":"5.6.1+really5.4.5-1ubuntu0.3"},{"consumers":["build","package"],"id":"zstd","kind":"binary","license":"BSD-3-Clause","materialization":{"destination":"usr/bin/zstd","mode":"0755","root":"toolchain","type":"file"},"mediaType":"application/octet-stream","name":"zstd","platform":"linux-amd64","sha256":"1c385004523815485355a1f44a58bba36d8c5fe7d827c1326316eba2f8de6d70","size":1304088,"sourceUrl":"https://raw.githubusercontent.com/sunwayking/JetOnlyOffice-license-evidence/v9.4.0-evidence.28/zstd/zstd-static","version":"1.5.7"}]}